pk_id,name,sound_path,fk_complexity,fk_pos,word_origin,word_meaning,word_usage,image_path,fk_game_type_id,status,created_by,created_on,updated_by,updated_on,pronunciation,2098,Asleep,SoundFiles/2098.mp4,2,5,Middle English,In a state of sleep,my foot is asleep,,0,2,0,2014-01-05 10:40:56,0,NULL,u’sleep,2099,Aspect,SoundFiles/2099.mp4,2,1,Latin,A distinct feature or element in a problem,a sad aspect,,0,2,0,2014-01-05 10:40:56,0,NULL,"’as,pekt",2100,Aspire,SoundFiles/2100.mp4,2,3,Latin,Have an ambitious plan or a lofty goal,The students in medical schools aspire to be doctors,,0,2,0,2014-01-05 10:40:56,0,NULL,u’spI(-u)r,2101,Assault,SoundFiles/2101.mp4,2,1,Latin,Close fighting during the culmination of a military attack,The mugger assaulted the woman,,0,2,0,2014-01-05 10:40:56,0,NULL,u’solt,2102,Assembly,SoundFiles/2102.mp4,2,1,French,A public facility to meet for open discussion,they demanded the right of assembly,,0,2,0,2014-01-05 10:40:56,0,NULL,u’sem-b(u-)lee,2103,Associate,SoundFiles/2103.mp4,2,1,Latin,One associated with another,He associates with strange people,,0,2,0,2014-01-05 10:40:56,0,NULL,u’sow-shee-ut,2104,Assume,SoundFiles/2104.mp4,2,3,Latin,To take up or in,I assume his train was late,,0,2,0,2014-01-05 10:40:56,0,NULL,u’s(y)oom,2105,Athlete,SoundFiles/2105.mp4,2,3,Greek,"A person who is trained or skilled in exercises, sports, or games requiring physical strength, agility, or stamina",He is a good athlete,,0,2,0,2014-01-05 10:40:56,0,NULL,ath-leet,2106,Atmosphere,SoundFiles/2106.mp4,2,3,Latin,The whole mass of air surrounding the earth,Plants respire through the oxygen in the atmosphere,,0,2,0,2014-01-05 10:40:56,0,NULL,"’at-mus,feer",2107,Attach,SoundFiles/2107.mp4,2,3,German,To bring (oneself) into an association,The spider’s thread attached to the window sill,,0,2,0,2014-01-05 10:40:56,0,NULL,u’tach,