pk_id,name,sound_path,fk_complexity,fk_pos,word_origin,word_meaning,word_usage,image_path,fk_game_type_id,status,created_by,created_on,updated_by,updated_on,pronunciation,3744,Imperfection,SoundFiles/3744.mp4,3,1,Latin,a fault or weakness in somebody/something,Imperfections of the world.,,0,2,0,2014-01-05 10:42:14,0,NULL,im-pu(r)'fek-shun,3745,Imperious,SoundFiles/3745.mp4,3,5,Latin,expecting people to obey you and treating them as if they are not as important as you,some economists are imperious of their colleagues in other social disciplines,,0,2,0,2014-01-05 10:42:14,0,NULL,im'peer-ee-us,3746,Impervious,SoundFiles/3746.mp4,3,5,Latin,not affected or influenced by something,someone impervious to argument,,0,2,0,2014-01-05 10:42:14,0,NULL,im'pur-vee-us,3747,Implement,SoundFiles/3747.mp4,3,1,Latin,to make something that has been officially decided start to happen or be used,implement a procedure,,0,2,0,2014-01-05 10:42:14,0,NULL,im-plu-munt,3748,Imposition,SoundFiles/3748.mp4,3,1,Latin,"the act of introducing something such as a new law or rule, or a new tax",he listened but  resented the imposition,,0,2,0,2014-01-05 10:42:14,0,NULL,im-pu'zi-shun,3749,Impracticable,SoundFiles/3749.mp4,3,5,Latin,impossible or very difficult to do,refloating the sunken ship proved impracticable because of its fragility,,0,2,0,2014-01-05 10:42:14,0,NULL,im'prak-ti-ku-bul,3750,Imprisonment,SoundFiles/3750.mp4,3,1,Latin,putting someone in prison or in jail as lawful punishment,the imprisonment of captured soldiers,,0,2,0,2014-01-05 10:42:14,0,NULL,im'pri-zun-munt,3751,Impromptu,SoundFiles/3751.mp4,3,1,Latin,done without preparation or planning,a witty impromptu must not sound premeditated,,0,2,0,2014-01-05 10:42:14,0,NULL,im'prómp-t(y)oo,3752,Impropriety,SoundFiles/3752.mp4,3,1,Latin,"behaviour or actions that are dishonest, morally wrong or not appropriate for a person in a position of responsibility",Accusations of impropriety were made against senior  government  ministers.,,0,2,0,2014-01-05 10:42:14,0,NULL,im-pru'prI-i-tee,3753,Improvisation,SoundFiles/3753.mp4,3,1,Latin,the act or an instance of improvising,Performing with this group is full of improvisation.,,0,2,0,2014-01-05 10:42:14,0,NULL,"im,pró-vu'zey-shun",3754,Impulsively,SoundFiles/3754.mp4,3,4,Latin,in an impulsive or impetuous way; without taking cautions,he often acts impulsively and later regrets it,,0,2,0,2014-01-05 10:42:14,0,NULL,im'púl-siv-lee,3755,Impurity,SoundFiles/3755.mp4,3,1,Latin,"a substance that is present in small amounts in another substance, making it dirty or of poor quality",there were impurities in the water,,0,2,0,2014-01-05 10:42:14,0,NULL,im'pyûr-i-tee,3756,Inaccurately,SoundFiles/3756.mp4,3,4,Latin,in an inaccurate manner,this student works rather inaccurately and sloppily,,0,2,0,2014-01-05 10:42:14,0,NULL,in'a-kyu-rut-lee,3757,Inadequacy,SoundFiles/3757.mp4,3,1,Latin,the state of not being enough or good enough,the inadequacy of unemployment benefits,,0,2,0,2014-01-05 10:42:14,0,NULL,in'a-di-kwu-see,3758,Inanimate,SoundFiles/3758.mp4,3,5,Latin,"not alive in the way that people, animals and plants are",the word 'car' is inanimate,,0,2,0,2014-01-05 10:42:14,0,NULL,in'a-nu-mut,3759,Inaugural,SoundFiles/3759.mp4,3,1,Latin,"first, and marking the beginning of something important, for example the time when a new leader or parliament starts work, when a new organization is formed or when something is used for the first time",the President's inaugural address,,0,2,0,2014-01-05 10:42:14,0,NULL,in'o-gyu-rul,3760,Inauspicious,SoundFiles/3760.mp4,3,5,Latin,showing signs that the future will not be good or successful,inauspicious circumstances,,0,2,0,2014-01-05 10:42:14,0,NULL,"i,no'spi-shus",3761,Incalculable,SoundFiles/3761.mp4,3,5,Latin,very large or very great; too great to calculate,What I owe to them all is incalculable,,0,2,0,2014-01-05 10:42:14,0,NULL,in'kal-kyu-lu-bul,3762,Incarcerate,SoundFiles/3762.mp4,3,3,Latin,to put somebody in prison or in another place from which they cannot escape,the murderer was incarcerated for the rest of his life,,0,2,0,2014-01-05 10:42:14,0,NULL,"in'kaa(r)-su,reyt",3763,Incendiary,SoundFiles/3763.mp4,3,1,Latin,designed to cause fires,an incendiary fire,,0,2,0,2014-01-05 10:42:14,0,NULL,"in'sen-dee,e-ree",3764,Incessant,SoundFiles/3764.mp4,3,5,Latin,never stopping,night and day we live with the incessant noise of the city,,0,2,0,2014-01-05 10:42:14,0,NULL,in'se-sunt,3765,Incitement,SoundFiles/3765.mp4,3,1,Latin,"the act of encouraging somebody to do something violent, illegal or unpleasant",the incitement of mutiny,,0,2,0,2014-01-05 10:42:14,0,NULL,in'sIt-munt,3766,Incivility,SoundFiles/3766.mp4,3,1,Latin,rude behaviour; rude remarks,An environmental incivility is any aspect of the environment about which people may be inclined to feel negatively.,,0,2,0,2014-01-05 10:42:14,0,NULL,in-su'vi-li-tee,3767,Incognito,SoundFiles/3767.mp4,3,4,Latin,in a way that prevents other people from finding out who you are,in Holland he lived incognito as a carpenter in the shipyards of the East India company,,0,2,0,2014-01-05 10:42:14,0,NULL,"in,kóg'nee-tow",3768,Incommode,SoundFiles/3768.mp4,3,3,Latin,to cause inconvenience or discomfort to,"Sorry to incommode you, but...",,0,2,0,2014-01-05 10:42:14,0,NULL,in-ku'mowd,3769,Incompatible,SoundFiles/3769.mp4,3,5,Latin,"two actions, ideas, etc. that are incompatible are not acceptable or possible together because of basic differences",incompatible personalities,,0,2,0,2014-01-05 10:42:14,0,NULL,in-kum'pa-tu-bul,3770,Incomprehensibly,SoundFiles/3770.mp4,3,5,Latin,Difficult or impossible to understand or comprehend; unintelligible,the foreigners spoke incomprehensibly,,0,2,0,2014-01-05 10:42:14,0,NULL,"in,kóm-pru'hen-su-b(u-)lee",3771,Inconceivable,SoundFiles/3771.mp4,3,5,Latin,impossible to imagine or believe,Whatever is inconceivable is impossible,,0,2,0,2014-01-05 10:42:14,0,NULL,in-kun'see-vu-bul,3772,Inconsequentially,SoundFiles/3772.mp4,3,4,Latin,lacking consequence,"You're so beautifully dressed,' she said and added quite inconsequentially, 'Can you stay the night?'",,0,2,0,2014-01-05 10:42:14,0,NULL,"in,kón-su'kewn-shu-lee",3773,Incorrigible,SoundFiles/3773.mp4,3,5,Latin,having bad habits which cannot be changed or improved,"So the incorrigible lives and thrives, nourished by the very society which he outrages",,0,2,0,2014-01-05 10:42:14,0,NULL,in'kor-u-ju-bul,3774,Indebtedness,SoundFiles/3774.mp4,3,1,Latin,an obligation to pay money to another person,Indebtedness of the company,,0,2,0,2014-01-05 10:42:14,0,NULL,in'de-tid-nus,3775,Indefinable,SoundFiles/3775.mp4,3,5,Latin,difficult or impossible to define or explain,an abstract concept that seems indefinable,,0,2,0,2014-01-05 10:42:14,0,NULL,in-du'fI-nu-bul,3776,Indigenous,SoundFiles/3776.mp4,3,5,Latin,belonging to a particular place rather than coming to it from somewhere else,the Ainu are indigenous to the northern most islands of Japan,,0,2,0,2014-01-05 10:42:14,0,NULL,in'di-ju-nus,3777,Inebriated,SoundFiles/3777.mp4,3,5,Latin,drunk,helplessly inebriated,,0,2,0,2014-01-05 10:42:14,0,NULL,"in'ee-bree,ey-tid",3778,Ineptitude,SoundFiles/3778.mp4,3,1,Latin,lack of skill,the drill sergeant's intent was to convince all the recruits of their ineptitude,,0,2,0,2014-01-05 10:42:14,0,NULL,"in'ep-ti,t(y)ood",3779,Inescapable,SoundFiles/3779.mp4,3,5,Latin,that you cannot avoid or ignore,inescapable conclusion,,0,2,0,2014-01-05 10:42:14,0,NULL,i-ni'skey-pu-bul,3780,Inexhaustible,SoundFiles/3780.mp4,3,5,Latin,that cannot be EXHAUSTED,an inexhaustible supply of coal,,0,2,0,2014-01-05 10:42:14,0,NULL,i-nig'zos-tu-bul,3781,Inextricable,SoundFiles/3781.mp4,3,5,Latin,too closely linked to be separated,an inextricable knot,,0,2,0,2014-01-05 10:42:14,0,NULL,in'ek-stri-ku-bul,3782,Infatuation,SoundFiles/3782.mp4,3,1,Latin,"very strong feelings of love or attraction for somebody/something, especially when these are unreasonable and do not last long",He has a delicate balance between anxiety and infatuation,,0,2,0,2014-01-05 10:42:14,0,NULL,"in, fa-choo'ey-shun",3783,Infernal,SoundFiles/3783.mp4,3,1,Latin,extremely annoying,"If it will rid me of these infernal wind chimes, then yes, gladly",,0,2,0,2014-01-05 10:42:14,0,NULL,in'fur-n(u)l,3784,Infertility,SoundFiles/3784.mp4,3,1,Latin,Absent or diminished fertility,Stress and depression are common among couples dealing with infertility.,,0,2,0,2014-01-05 10:42:14,0,NULL,"in,fur'ti-lu-tee",3785,Infiltrate,SoundFiles/3785.mp4,3,3,French,to pass slowly into something,The student organization was infiltrated by a traitor,,0,2,0,2014-01-05 10:42:14,0,NULL,"in'fil,treyt",3786,Infinitesimal,SoundFiles/3786.mp4,3,5,Latin,extremely small,Infinitesimal amount of all his good qualities.,,0,2,0,2014-01-05 10:42:14,0,NULL,in-fi-ni'te-su-mul,3787,Inflammable,SoundFiles/3787.mp4,3,5,Latin,full of strong emotions or violence,Inflammable liquids were indrums or in export wooden cases having inside containers,,0,2,0,2014-01-05 10:42:14,0,NULL,in'fla-mu-bul,